{
  "schema_version": "1.0.0",
  "as_of": "2026-10-20",
  "layout": {
    "column_width": 252,
    "row_height": 74,
    "node_width": 196,
    "node_height": 50,
    "padding": 48
  },
  "columns": [
    {
      "id": "sources",
      "title": "Sources",
      "system": null
    },
    {
      "id": "s1",
      "title": "System 1 \u2014 The Brain",
      "system": "system-1",
      "subtitle": "Computer 1 \u00b7 intermittent"
    },
    {
      "id": "bus-a",
      "title": "Artifacts & signal bus",
      "system": null,
      "subtitle": "GCS + Pub/Sub"
    },
    {
      "id": "s3",
      "title": "System 3 \u2014 The Guardian",
      "system": "system-3",
      "subtitle": "Computer 3 \u00b7 always on"
    },
    {
      "id": "bus-b",
      "title": "Order & fill bus",
      "system": null,
      "subtitle": "Pub/Sub"
    },
    {
      "id": "s2",
      "title": "System 2 \u2014 The Hand",
      "system": "system-2",
      "subtitle": "Computer 2 \u00b7 market hours"
    },
    {
      "id": "edge",
      "title": "Market & operator",
      "system": null
    }
  ],
  "nodes": [
    {
      "id": "oanda-data",
      "column": "sources",
      "row": 0,
      "label": "OANDA v20 price API",
      "kind": "source",
      "status": "live",
      "detail": {
        "technical": "REST practice endpoint. MBA candles \u2014 mid, bid and ask in a single request \u2014 across H1, H4 and D1.",
        "plain": "The broker's price history feed. Where every number in the system originally comes from."
      }
    },
    {
      "id": "macro",
      "column": "sources",
      "row": 3,
      "label": "Macro event text",
      "kind": "source",
      "status": "planned",
      "detail": {
        "technical": "Scraped macro headlines scored by FinBERT into `fact_macro_events`. Implemented and ingest-capable, but MODEL-010 never wired it in as a feature or a gate.",
        "plain": "News and economic announcements. The reading machinery exists but nothing currently listens to it."
      }
    },
    {
      "id": "s1-ingest",
      "column": "s1",
      "row": 0,
      "label": "MODEL-001 \u00b7 Ingest",
      "kind": "process",
      "status": "live",
      "detail": {
        "technical": "`multi_timeframe_ingest.py` + `dq.py`. Idempotent upsert into `fact_market_prices` (~4.68 M rows). Daily batch plus a weekly Saturday cron.",
        "plain": "Collects the price history and refuses it if there are holes."
      }
    },
    {
      "id": "s1-features",
      "column": "s1",
      "row": 1,
      "label": "MODEL-002 \u00b7 Feature store",
      "kind": "process",
      "status": "live",
      "detail": {
        "technical": "Versioned Parquet, trailing-only, byte-deterministic. `feature-store/{version}/`.",
        "plain": "Turns raw prices into the measurements models read. Never uses a future bar."
      }
    },
    {
      "id": "s1-regime",
      "column": "s1",
      "row": 2,
      "label": "MODEL-003 \u00b7 Regimes",
      "kind": "process",
      "status": "live",
      "detail": {
        "technical": "Two labels exist, and only one is currently usable live. The HMM's `regime_causal` (4-state Gaussian, D1/H4/H1, K-Means fallback below 0.70, kappa \u2265 0.83) is the originally-designed label but is NULL on the newest rows, so nothing live routes on it. The system runs live on `regime_structural` (ADX + rolling ATR% z-score) from `regime/build_structural.py` \u2014 now (R2, 2026-09-05) the single place the label is computed, writing full history from a fixed anchor date into `fact_regime_structural`; every consumer reads that table rather than recomputing. As of Work Order 03 (active) the label is being re-derived with a per-time-of-day-slot volatility baseline to remove a diurnal-seasonality defect that mislabelled ~20-30% of H1/H4 bars.",
        "plain": "Labels every moment of history as trending up, trending down, sideways or violent. The originally-designed detector goes blank on recent data, so a backup detector \u2014 measuring trend strength and how choppy prices are \u2014 is what actually drives live decisions today. That backup detector is mid-repair: it was comparing volatility at 3am to an average built from all hours of the day, which made quiet nights and busy afternoons look like different market regimes when the market itself hadn't changed."
      }
    },
    {
      "id": "s1-outcomes",
      "column": "s1",
      "row": 3,
      "label": "Backtest \u2192 outcomes",
      "kind": "process",
      "status": "live",
      "detail": {
        "technical": "`layer0/persist_trade_outcomes.py` runs each strategy on its declared `primary_granularity` and writes `fact_trade_outcomes` (55,756 rows). Destructive DELETE-then-rebuild \u2014 snapshot first.",
        "plain": "Replays every trading rule across all of history and writes down every trade it would have taken."
      }
    },
    {
      "id": "s1-attrib",
      "column": "s1",
      "row": 4,
      "label": "MODEL-004 \u00b7 Attribution",
      "kind": "process",
      "status": "live",
      "detail": {
        "technical": "Point-in-time join of each trade to the **causal** regime at entry. Metrics on OOS trades only, Bayesian shrinkage for thin cells. 40 cells / 38,610 OOS trades.",
        "plain": "Files each historical trade under the market weather it was opened in, then scores each rule per weather."
      }
    },
    {
      "id": "s1-vet",
      "column": "s1",
      "row": 5,
      "label": "MODEL-005 \u00b7 Vetting",
      "kind": "process",
      "status": "degraded",
      "detail": {
        "technical": "PF \u2265 1.5, Sharpe \u2265 0.8, MaxDD \u2264 25%, WinRate \u2265 40%, Recovery \u2265 3.0, **OOS \u2265 12mo** (lowered from 60 by owner decision 2026-08-21). `INTEGRITY_DISQUALIFIED` checked first, separately. **No minimum trade-count gate** \u2014 which is how 5-, 13- and 20-trade cells qualified. **The map's output is now under contract** (R1, `vetting/map_contract.py`, 2026-09-05): a published map states the label it was selected under, carries a 7-day expiry, and is inadmissible if its stated label disagrees with what the live path is actually routing on \u2014 every defect fails closed, never permissively. The live map expired **2026-08-24** and has not been replaced (Work Order 03, active, is fixing a diurnal-seasonality defect in the label before re-publishing), so **the system is not currently trading** \u2014 the contract working as designed, not a new failure.",
        "plain": "The examiner. Six pass marks plus a blacklist for rules whose track record is known to be fiction. One mark was deliberately relaxed in August, and there has never been a rule about how many trades the evidence must rest on. A newer safety rule now also expires the examiner's report card after a week \u2014 and the current one has expired, so the system has stopped trading on it rather than keep using stale results."
      }
    },
    {
      "id": "s1-gate",
      "column": "s1",
      "row": 6,
      "label": "MODEL-006 \u00b7 Gatekeeper (shadow)",
      "kind": "process",
      "status": "degraded",
      "detail": {
        "technical": "XGBoost on causal-regime features, expanding-window walk-forward, per-regime thresholds, bootstrap-significant OOS uplift required. **It scores live but does not gate**: `Scorer` never loads its own manifest, so the calibrated cutoffs (0.60\u20130.80) are never read at inference and the caller stamps a hardcoded 0.5. Enforcing them would refuse 14 of 15 live map cells, so the gate runs in shadow \u2014 verdict recorded, never applied. FIX-S1-018. **Deeper finding (Work Order 04 Phase 1, 2026-09-08):** the deployed champion is 95.5% degenerate on (strategy \u00d7 regime) cells \u2014 `strategy_id` carries 96.78% of gain importance, the regime feature 0.21%. It discriminates on which strategy fired, not on market state, and predates this month's regime-label work. Retraining is currently refused by the same guard (`MAX_DEGENERATE_CELL_SHARE`), correctly. Fix (Phase 2) is blocked on the regime label settling.",
        "plain": "Trains the referee that vetoes individual trades. The referee does watch every live signal and forms an opinion \u2014 but nobody is currently listening to it. Its verdicts are written down so we can measure what obeying them would cost, which turns out to be about 93% of all signals. A closer look found the referee itself has a deeper problem: it isn't really reading the market's mood at all, it has memorised which strategy is speaking and answers based on that. The safety check that would catch a broken retrain is refusing to let a new version through until that's fixed."
      }
    },
    {
      "id": "s1-pub",
      "column": "s1",
      "row": 7,
      "label": "MODEL-007 \u00b7 Publish",
      "kind": "process",
      "status": "live",
      "detail": {
        "technical": "Immutable versioned prefix \u2192 secret scan \u2192 SHA256 round-trip verify \u2192 **then** atomic `latest.json` flip. Superseded pointer archived to `previous.json`.",
        "plain": "Seals the box, re-checks the seal after shipping, and only then updates the sign saying which box is current."
      }
    },
    {
      "id": "s1-queue",
      "column": "s1",
      "row": 8,
      "label": "MODEL-008 \u00b7 Signal producer",
      "kind": "process",
      "status": "degraded",
      "detail": {